<?xml version="1.0" encoding="UTF-8"?>
<!--

    Copyright 2005-2013 Dozer Project

    Licensed under the Apache License, Version 2.0 (the "License");
    you may not use this file except in compliance with the License.
    You may obtain a copy of the License at

         http://www.apache.org/licenses/LICENSE-2.0

    Unless required by applicable law or agreed to in writing, software
    distributed under the License is distributed on an "AS IS" BASIS,
    WITHOUT WARRANTIES OR CONDITIONS OF ANY KIND, either express or implied.
    See the License for the specific language governing permissions and
    limitations under the License.

-->
<mappings xmlns="http://dozer.sourceforge.net"
          xmlns:xsi="http://www.w3.org/2001/XMLSchema-instance"
          xsi:schemaLocation="http://dozer.sourceforge.net http://dozer.sourceforge.net/schema/beanmapping.xsd">

  <configuration>
    <stop-on-errors>true</stop-on-errors>
    <wildcard>true</wildcard>
    <custom-converters>
      <converter type="org.dozer.spring.functional_tests.support.InjectedCustomConverter">
        <class-a>org.dozer.spring.vo.Source</class-a>
        <class-b>org.dozer.spring.vo.Destination</class-b>
      </converter>
    </custom-converters>
  </configuration>

</mappings>