<?xml version="1.0" encoding="UTF-8"?>
<mappings xmlns="http://dozer.sourceforge.net"
          xmlns:xsi="http://www.w3.org/2001/XMLSchema-instance"
          xsi:schemaLocation="http://dozer.sourceforge.net http://dozer.sourceforge.net/schema/beanmapping.xsd">
  <mapping>
    <class-a>org.dozer.vo.enumtest.MyBean</class-a>
    <class-b>org.dozer.vo.enumtest.MyBeanPrime</class-b>
    <field>
      <a>srcType</a>
      <b>destType</b>
    </field>
    <field>
      <a>srcTypeWithOverride</a>
      <b>destTypeWithOverride</b>
    </field>
  </mapping>
</mappings>